subreddit,topic_id,proposed_topic_name,top_words,weights
Metal,1,Temat 1 — do interpretacji ręcznej,"death, blood, sound, black, riff, love, well, record, bit, kill","0.0111, 0.0082, 0.008, 0.0076, 0.0071, 0.0069, 0.0056, 0.0055, 0.0054, 0.0054"
Metal,2,Temat 2 — do interpretacji ręcznej,"run, year, favorite, see, shit, video, holy, live, well, iron","0.0168, 0.0164, 0.0138, 0.0122, 0.0104, 0.0103, 0.0102, 0.0088, 0.0075, 0.0068"
Metal,3,Temat 3 — do interpretacji ręcznej,"see, love, great, first, listen, live, hear, guy, year, play","0.0233, 0.0181, 0.0155, 0.0145, 0.0116, 0.0112, 0.011, 0.0107, 0.0099, 0.0095"
Metal,4,Temat 4 — do interpretacji ręcznej,"metal, sound, look, new, death, name, well, first, though, lot","0.0317, 0.0207, 0.012, 0.0113, 0.0109, 0.0098, 0.0092, 0.0091, 0.0081, 0.0078"
Metal,5,Temat 5 — do interpretacji ręcznej,"metal, well, death, doom, post, say, listen, something, great, actually","0.0122, 0.0122, 0.0119, 0.0115, 0.0098, 0.009, 0.009, 0.0079, 0.0074, 0.0073"
Metal,6,Temat 6 — do interpretacji ręcznej,"metal, black, death, new, check, release, listen, thrash, heavy, stuff","0.0825, 0.0361, 0.0179, 0.0128, 0.011, 0.0108, 0.0098, 0.0093, 0.0093, 0.0087"
Metal,7,Temat 7 — do interpretacji ręcznej,"listen, year, feel, come, lot, find, hear, pretty, see, metal","0.0221, 0.0109, 0.0088, 0.0087, 0.0085, 0.0082, 0.0079, 0.0075, 0.0075, 0.0075"
hiphopheads,1,Temat 1 — do interpretacji ręcznej,"listen, hear, lot, first, feel, sound, find, great, see, new","0.0218, 0.0122, 0.0116, 0.0103, 0.0098, 0.0087, 0.0081, 0.0077, 0.0076, 0.0075"
hiphopheads,2,Temat 2 — do interpretacji ręcznej,"big, well, pretty, sample, fan, feel, something, always, thing, say","0.018, 0.0147, 0.0075, 0.0075, 0.0072, 0.0062, 0.0062, 0.006, 0.0059, 0.0059"
hiphopheads,3,Temat 3 — do interpretacji ręcznej,"year, day, never, kanye, pretty, feel, release, shit, come, great","0.0104, 0.0097, 0.0088, 0.0081, 0.0079, 0.0074, 0.0073, 0.0071, 0.007, 0.0068"
hiphopheads,4,Temat 4 — do interpretacji ręcznej,"hop, hip, say, listen, lmao, rapper, rap, see, shit, video","0.0224, 0.0206, 0.0183, 0.0131, 0.0117, 0.0113, 0.011, 0.0099, 0.0098, 0.0089"
hiphopheads,5,Temat 5 — do interpretacji ręcznej,"beat, well, love, year, sound, lil, favorite, verse, rap, come","0.0144, 0.0123, 0.0115, 0.01, 0.0096, 0.0093, 0.0085, 0.0077, 0.0074, 0.0074"
hiphopheads,6,Temat 6 — do interpretacji ręcznej,"say, shit, try, black, comment, thing, see, bad, fuck, someone","0.0234, 0.0128, 0.0086, 0.0081, 0.0075, 0.0074, 0.0074, 0.0073, 0.0072, 0.0065"
hiphopheads,7,Temat 7 — do interpretacji ręcznej,"year, man, say, case, month, police, black, woman, every, drop","0.0177, 0.0102, 0.0099, 0.0097, 0.0089, 0.0084, 0.0079, 0.0079, 0.0079, 0.0078"
indieheads,1,Temat 1 — do interpretacji ręcznej,"year, see, come, guy, love, great, last, play, new, take","0.0234, 0.017, 0.012, 0.0103, 0.0102, 0.009, 0.0084, 0.0083, 0.0072, 0.0071"
indieheads,2,Temat 2 — do interpretacji ręcznej,"listen, feel, well, day, lot, great, stuff, look, sound, hear","0.0189, 0.0179, 0.0096, 0.0089, 0.0083, 0.0073, 0.0072, 0.0071, 0.007, 0.0068"
indieheads,3,Temat 3 — do interpretacji ręcznej,"love, new, listen, hear, see, never, bad, say, release, first","0.0196, 0.0142, 0.0136, 0.0116, 0.0097, 0.0096, 0.0078, 0.0077, 0.0076, 0.0075"
indieheads,4,Temat 4 — do interpretacji ręcznej,"thing, feel, well, something, try, lot, work, want, kind, find","0.0148, 0.012, 0.0099, 0.0099, 0.0095, 0.0091, 0.0091, 0.0078, 0.0067, 0.0063"
indieheads,5,Temat 5 — do interpretacji ręcznej,"sound, indie, love, pop, rock, favorite, pretty, say, guitar, play","0.0164, 0.0161, 0.0148, 0.0124, 0.0119, 0.0107, 0.0103, 0.0098, 0.0087, 0.008"
indieheads,6,Temat 6 — do interpretacji ręcznej,"post, playlist, comment, spotify, indiehead, please, add, youtube, top, punk","0.0624, 0.0281, 0.024, 0.022, 0.0187, 0.018, 0.0154, 0.0154, 0.0137, 0.012"
indieheads,7,Temat 7 — do interpretacji ręcznej,"see, live, love, say, back, eye, rate, year, fan, day","0.0095, 0.0089, 0.0081, 0.0076, 0.0076, 0.0064, 0.006, 0.0059, 0.0058, 0.0056"
popheads,1,Temat 1 — do interpretacji ręcznej,"say, want, taylor, give, take, britney, could, see, year, someone","0.0151, 0.0105, 0.0084, 0.0081, 0.0073, 0.0064, 0.0063, 0.0058, 0.0058, 0.0052"
popheads,2,Temat 2 — do interpretacji ręcznej,"listen, hear, lol, spotify, love, anyone, taylor, win, playlist, feel","0.0096, 0.0088, 0.0088, 0.0082, 0.008, 0.0072, 0.007, 0.0064, 0.0061, 0.0059"
popheads,3,Temat 3 — do interpretacji ręcznej,"pop, sound, love, well, feel, listen, great, lyric, voice, could","0.0206, 0.0172, 0.0162, 0.012, 0.0092, 0.0078, 0.007, 0.0067, 0.0063, 0.0059"
popheads,4,Temat 4 — do interpretacji ręcznej,"say, see, post, comment, use, fan, thing, mean, actually, twitter","0.0221, 0.0135, 0.0116, 0.011, 0.0102, 0.0102, 0.0097, 0.0081, 0.0069, 0.0066"
popheads,5,Temat 5 — do interpretacji ręcznej,"black, see, woman, white, year, country, use, say, man, mean","0.0128, 0.0116, 0.0113, 0.0105, 0.0077, 0.007, 0.0067, 0.0067, 0.0064, 0.0054"
popheads,6,Temat 6 — do interpretacji ręcznej,"chart, well, see, katy, look, come, number, radio, cover, hit","0.019, 0.0149, 0.0112, 0.0107, 0.0103, 0.0102, 0.0101, 0.0099, 0.0098, 0.0086"
popheads,7,Temat 7 — do interpretacji ręcznej,"year, love, release, feel, listen, single, first, day, come, new","0.0163, 0.0155, 0.0132, 0.0124, 0.0099, 0.0088, 0.0084, 0.0083, 0.0074, 0.0072"
