społeczność,temat,interpretacja
Metal,1,Ekstremalne odmiany metalu i ciężkie brzmienia
Metal,2,Codzienne dyskusje i reakcje użytkowników
Metal,3,Odsłuch muzyki i emocje związane z utworami
Metal,4,Nowe albumy i klasyczne elementy metalu
Metal,5,Podgatunki metalu i stylistyka
Metal,6,Premiery i rekomendacje albumów
Metal,7,Opinie użytkowników i pierwsze wrażenia
Hip-hop,1,Odsłuch utworów i reakcje emocjonalne
Hip-hop,2,Luźne rozmowy i komentarze społeczności
Hip-hop,3,Premiery albumów i popularni artyści
Hip-hop,4,Kultura rapowa i wykonawcy
Hip-hop,5,Ocena beatów i jakości utworów
Hip-hop,6,Komentarze i dyskusje społeczności
Hip-hop,7,Dyskusje społeczne i bieżące wydarzenia
Indie,1,Ocena utworów i pozytywne reakcje
Indie,2,Codzienne rozmowy o muzyce
Indie,3,Emocjonalny odbiór muzyki
Indie,4,Luźne komentarze i opinie użytkowników
Indie,5,Gatunki alternatywne i gust muzyczny
Indie,6,Playlisty i rekomendacje Spotify
Indie,7,Subiektywne opinie i oceny utworów
Pop,1,Popularni artyści popowi i fandom
Pop,2,Streaming i słuchanie muzyki
Pop,3,Mainstreamowy pop i odbiór utworów
Pop,4,Komentowanie postów i aktywność społeczności
Pop,5,Wizerunek artystów i kultura popularna
Pop,6,Listy przebojów i popularność utworów
Pop,7,Premiery singli i reakcje fanów
